<?xml version="1.0" encoding="utf-8"?>
<Presets xmlns="YaogUI" xmlns:xsi="http://www.w3.org/2001/XMLSchema-instance" xsi:schemaLocation="YaogUI storage_presets.xsd">
    <Preset name="Outer Gear" CanSale="true" priority="Normal">
        <Kind name="Equipment">
            <Label>Weapon</Label>
            <Label>Cape</Label>
            <Label>Clothes</Label>
            <Label>Trousers</Label>
            <Label>Treasure</Label>
        </Kind>
    </Preset>
    <Preset name="Pills" priority="High" CanSale="true">
        <Kind name="Material">
            <Label>Drug</Label>
            <Label>Dan</Label>
        </Kind>
    </Preset>
    <Preset name="Hot Stuff" priority="High" CanSale="true">
        <Kind name="Practice">
            <Label>Rock</Label>
            <Label>RockBlock</Label>
            <Label>Metal</Label>
            <Label>Dan</Label>
            <Label>Food</Label>
            <Label>Ingredient</Label>
            <Label>FightFabao</Label>
            <Label>TreasureFabao</Label>
            <Label>Drug</Label>
            <Label>Bone</Label>
        </Kind>
        <Tier min="6"/>
        <Elements>
            <Label>Fire</Label>
        </Elements>
    </Preset>
    <Preset name="Talismans" priority="High">
        <Kind name="Practice">
            <Label>SpellPaper</Label>
            <Label>Spell</Label>
        </Kind>
    </Preset>
    <Preset name="Manuals" priority="High">
        <Kind>
            <Label>Esoterica</Label>
        </Kind>
    </Preset>

    <Preset name="Artifacts" priority="High" CanSale="true">
        <Kind>
            <Label>FightFabao</Label>
        </Kind>
    </Preset>
    <Preset name="Mounts" priority="High">
        <Kind>
            <Label>Horse</Label>
        </Kind>
    </Preset>
    <Preset name="Relics" priority="High" onlyFSItem="true">
    </Preset>
</Presets>